{
  "manifest": {
    "schemaVersion": 1,
    "modelVersionId": "set.yolo-v1",
    "classes": [
      "seed"
    ],
    "artifact": {
      "kind": "ultralytics",
      "digest": "aaaaaaaaaaaaaaaaaaaaaaaaaaaaaaaaaaaaaaaaaaaaaaaaaaaaaaaaaaaaaaaa",
      "weights": {
        "digest": "cccccccccccccccccccccccccccccccccccccccccccccccccccccccccccccccc",
        "bytes": 1024
      },
      "inference": {
        "confidence": 0.42,
        "imageSize": 768,
        "maxDetections": 500,
        "endToEnd": false
      },
      "validation": {
        "precision": 0.6,
        "recall": 0.5,
        "map50": 0.7,
        "map50To95": 0.4,
        "fitness": 0.43
      },
      "training": {
        "baseModel": {
          "reference": "yolo26n.pt",
          "digest": "bbbbbbbbbbbbbbbbbbbbbbbbbbbbbbbbbbbbbbbbbbbbbbbbbbbbbbbbbbbbbbbb"
        },
        "parameters": {
          "epochs": 50,
          "patience": 20,
          "batch": 8,
          "imgsz": 1024,
          "optimizer": "AdamW",
          "lr0": 0.001,
          "warmup_epochs": 3.0,
          "mosaic": 0.0,
          "mixup": 0.0,
          "copy_paste": 0.0,
          "max_det": 500,
          "seed": 0,
          "deterministic": true
        },
        "runtime": {
          "framework": "ultralytics",
          "version": "8.4.131"
        }
      }
    }
  },
  "image": "dddddddddddddddddddddddddddddddddddddddddddddddddddddddddddddddd",
  "attempt": 1,
  "serverTime": "2026-10-27T00:00:00.000Z",
  "leaseExpiresAt": "2026-10-27T00:01:30.000Z",
  "deadlineAt": "2026-10-27T00:15:00.000Z"
}
