{
  "manifest": {
    "schemaVersion": 1,
    "modelVersionId": "set.traditional-v1",
    "classes": [
      "seed"
    ],
    "artifact": {
      "kind": "traditional",
      "digest": "aaaaaaaaaaaaaaaaaaaaaaaaaaaaaaaaaaaaaaaaaaaaaaaaaaaaaaaaaaaaaaaa"
    }
  },
  "image": "cccccccccccccccccccccccccccccccccccccccccccccccccccccccccccccccc",
  "attempt": 1,
  "serverTime": "2026-10-27T00:00:00.000Z",
  "leaseExpiresAt": "2026-10-27T00:01:30.000Z",
  "deadlineAt": "2026-10-27T00:15:00.000Z"
}
